{
  "$schema": "https://json-schema.org/draft/2020-12/schema",
  "$id": "offline-interview.interview-spec.v1",
  "title": "Offline Interview Spec v1",
  "type": "object",
  "additionalProperties": false,
  "required": ["schema", "id", "version", "title", "context", "objective", "language", "tags", "participants", "sections"],
  "properties": {
    "schema": {"const": "offline-interview.interview-spec.v1"},
    "id": {"type": "string", "minLength": 1},
    "version": {"const": "1.0"},
    "title": {"type": "string", "minLength": 1},
    "context": {"type": "string"},
    "objective": {"type": "string", "minLength": 1},
    "language": {"type": "string", "minLength": 2},
    "tags": {
      "type": "array",
      "items": {"type": "string", "minLength": 1},
      "uniqueItems": true
    },
    "participants": {
      "type": "array",
      "minItems": 1,
      "items": {"$ref": "#/$defs/participant"}
    },
    "sections": {
      "type": "array",
      "minItems": 1,
      "items": {"$ref": "#/$defs/section"}
    }
  },
  "$defs": {
    "participant": {
      "type": "object",
      "additionalProperties": false,
      "required": ["id", "name", "role"],
      "properties": {
        "id": {"type": "string", "minLength": 1},
        "name": {"type": "string", "minLength": 1},
        "role": {"enum": ["interviewer", "interviewee", "other"]}
      }
    },
    "section": {
      "type": "object",
      "additionalProperties": false,
      "required": ["id", "title", "questions"],
      "properties": {
        "id": {"type": "string", "minLength": 1},
        "title": {"type": "string", "minLength": 1},
        "questions": {
          "type": "array",
          "minItems": 1,
          "items": {"$ref": "#/$defs/question"}
        }
      }
    },
    "question": {
      "type": "object",
      "additionalProperties": false,
      "required": ["id", "text", "intent", "required", "audience", "followUps"],
      "properties": {
        "id": {"type": "string", "minLength": 1},
        "text": {"type": "string", "minLength": 1},
        "intent": {"type": "string", "minLength": 1},
        "required": {"type": "boolean"},
        "audience": {
          "type": "array",
          "items": {"type": "string", "minLength": 1},
          "uniqueItems": true
        },
        "followUps": {
          "type": "array",
          "items": {"$ref": "#/$defs/followUp"}
        }
      }
    },
    "followUp": {
      "type": "object",
      "additionalProperties": false,
      "required": ["id", "text", "kind"],
      "properties": {
        "id": {"type": "string", "minLength": 1},
        "text": {"type": "string", "minLength": 1},
        "kind": {"const": "planned"}
      }
    }
  }
}
